Handle,Command,Title,Body HTML,Tags Command,Metafield: custom.tasting_notes [single_line_text_field],Metafield: custom.best_enjoyed [single_line_text_field],Metafield: custom.origin [single_line_text_field],Metafield: custom.tea_type [single_line_text_field]
organic-lemongrass-botanicals,MERGE,Organic Lemongrass Botanicals,"<p>That distinct, bright lemon aroma that makes any blend instantly more interesting. Our Organic Lemongrass is full of natural benefits and brews into a fresh, citrusy cup that&#x27;s light, clean, and genuinely uplifting. Use it on its own or blend it into your favourite tea.</p>",MERGE,"Fresh, citrusy, bright lemon aroma",Hot or cold — any time of day,,
organic-calendula-petals-botanicals,MERGE,Organic Calendula Petals Botanicals,"<p>Bright, bold, and historically one of the most medicinal botanicals around. Don&#x27;t let the sunny yellow colour fool you Calendula has a distinct peppery, slightly bitter flavour that adds real depth to herbal blends. Used for centuries to support healing. The botanical that works as hard as it looks.</p>",MERGE,"Peppery, slightly bitter, earthy",Blended into herbal mixes,,
organic-licorice-spice,MERGE,Organic Licorice Spice,"<p>Naturally sweet with undertones of mint and anise, Licorice brings a delicate, distinctive depth to everything it touches. Beyond the candy aisle, it shines in desserts like ice cream, cookies, and cakes, and pairs beautifully with mint, ginger, rhubarb, and raspberries. The spice that surprises you every time.</p>",MERGE,"Naturally sweet, mint and anise undertones","Desserts, baking, and sweet beverages",,
organic-star-anise-spice,MERGE,Organic Star Anise Spice,"<p>From the lush terrains of southeastern China and Vietnam comes one of the most distinctive spices in the world. A sweet, peppery warmth that&#x27;s reminiscent of licorice, Star Anise elevates soups, stews, and slow-cooked meat dishes to something genuinely special. Pairs beautifully with cloves, ginger, nutmeg, and garlic.</p>",MERGE,"Sweet, peppery, licorice-like warmth","Soups, stews, and savoury meat dishes",,
organic-elderberries-botanicals,MERGE,Organic Elderberries Botanicals,"<p>Dark, deep, and rich with history. Elderberries from the European elder tree have been used for centuries to make medicine, jellies, jams, and wine and they brew into an equally impressive cup of tea. Bold, fruity, and naturally powerful.</p>",MERGE,"Rich, dark berry, fruity and full-bodied",Hot or cold — on its own or blended,,
